id,nombre,actividad,area,prioridad,fechaFin,semana,estatus,notas,createdAt,updatedAt
"ex2","Miguel Benítez3","Documentar integración Smartsheet con dashboard DTIdsd","Capital Humano","Media","2026-07-03","2026-W26","En proceso","","2026-06-23T10:00:00","2026-06-23T17:32:40.552Z"
"mqqxblg91tg","raul hernandez","revisar computadoras","","Media","2026-06-24","2026-W26","Atrasado","","2026-06-23T17:33:59.769Z","2026-06-25T15:04:14.827Z"
"mqtn223w69s","Josue Montoya","generar sesion","","Media","2026-07-08","2026-W26","En proceso","","2026-06-25T15:09:57.164Z","2026-06-25T15:09:57.164Z"
"mqtn86noodd","lugo morales","enviar correo","","Media","2026-06-30","2026-W26","En proceso","","2026-06-25T15:14:42.996Z","2026-06-25T15:14:42.996Z"
"mqtn9j5o85f","hernesto cedillo","fsfssdf","","Media","2026-07-01","2026-W26","En proceso","","2026-06-25T15:15:45.852Z","2026-06-25T15:15:45.852Z"
"mqtqyw66ofa","rfsdrsdf","fsdgsdgsd","","Media","2026-07-31","2026-W26","En proceso","","2026-06-25T16:59:27.966Z","2026-06-25T16:59:27.966Z"
"ex1","Eduardo Sanchez","Revisión de avance del proyecto Talleres || Mecánica Mx","Talleres","Alta","2026-06-23","2026-W26","Atrasado","Pendiente revisión con el cliente.","2026-06-23T09:00:00","2026-06-26T03:07:39.411Z"
"ex3","Ricardo Ángeles","Pruebas de conectividad API Mecánica MX Fase 2","Integraciones","Alta","2026-06-25","2026-W26","En proceso","Bloqueado por accesos al servidor de producción.","2026-06-23T08:00:00","2026-06-26T03:07:39.411Z"
"ex4","Josue Montoya","Actualizar dashboard DTI con módulo Actividades Semanales","DTI","Alta","2026-06-23","2026-W26","Concluido","","2026-06-23T07:00:00","2026-06-23T07:00:00"
"ex5","Eduardo Sanchez","Reunión de seguimiento proyectos IMC con dirección","Talleres","Media","2026-06-24","2026-W26","Atrasado","","2026-06-23T09:30:00","2026-06-26T03:07:39.411Z"
"ex6","Miguel Benítez","Configuración de campos BUK Personalizado Fase 2","Capital Humano","Baja","2026-06-26","2026-W26","En proceso","","2026-06-23T10:30:00","2026-06-23T10:30:00"
"ex7","Ricardo Ángeles","Entrega de análisis de requerimientos — AI HUB FLEX","Automatización","Alta","2026-06-20","2026-W25","Concluido","","2026-06-16T09:00:00","2026-06-20T16:00:00"
"ex8","Josue Montoya","Revisión de arquitectura del reporte Informe General","DTI","Media","2026-06-18","2026-W25","Concluido","","2026-06-16T08:00:00","2026-06-18T12:00:00"